{
  "state": "needs_attention",
  "checks": [
    {
      "name": "asdf",
      "status": "warning",
      "message": "asdf not available",
      "path": ""
    },
    {
      "name": "npm",
      "status": "ok",
      "message": "found",
      "path": "/root/.nvm/versions/node/v20.19.4/bin/npm"
    },
    {
      "name": "npx",
      "status": "ok",
      "message": "found",
      "path": "/root/.nvm/versions/node/v20.19.4/bin/npx"
    },
    {
      "name": "act",
      "status": "warning",
      "message": "failed to download https://github.com/nektos/act/releases/download/v0.2.59/act_Linux_x86_64.tar.gz",
      "path": ""
    },
    {
      "name": "k6",
      "status": "warning",
      "message": "failed to download https://github.com/grafana/k6/releases/download/v0.45.0/k6-v0.45.0-linux-amd64.tar.gz",
      "path": ""
    },
    {
      "name": "schemathesis",
      "status": "warning",
      "message": "pip install --user schemathesis failed",
      "path": ""
    },
    {
      "name": "bandit",
      "status": "ok",
      "message": "found",
      "path": "/workspace/lame-rms/automation/bin/tools/bandit"
    },
    {
      "name": "playwright",
      "status": "warning",
      "message": "npx playwright install failed",
      "path": ""
    },
    {
      "name": "terraform",
      "status": "warning",
      "message": "failed to download https://releases.hashicorp.com/terraform/1.6.6/terraform_1.6.6_linux_amd64.zip",
      "path": ""
    },
    {
      "name": "helm",
      "status": "warning",
      "message": "failed to download https://get.helm.sh/helm-v3.14.4-linux-amd64.tar.gz",
      "path": ""
    }
  ],
  "artifacts": [],
  "last_run": "2025-10-31T12:21:24.528278+00:00",
  "warnings": [
    {
      "tool": "asdf",
      "message": "asdf not available"
    },
    {
      "tool": "act",
      "message": "failed to download https://github.com/nektos/act/releases/download/v0.2.59/act_Linux_x86_64.tar.gz"
    },
    {
      "tool": "k6",
      "message": "failed to download https://github.com/grafana/k6/releases/download/v0.45.0/k6-v0.45.0-linux-amd64.tar.gz"
    },
    {
      "tool": "schemathesis",
      "message": "pip install --user schemathesis failed"
    },
    {
      "tool": "playwright",
      "message": "npx playwright install failed"
    },
    {
      "tool": "terraform",
      "message": "failed to download https://releases.hashicorp.com/terraform/1.6.6/terraform_1.6.6_linux_amd64.zip"
    },
    {
      "tool": "helm",
      "message": "failed to download https://get.helm.sh/helm-v3.14.4-linux-amd64.tar.gz"
    }
  ],
  "notes": [],
  "extra": {
    "tools_summary": {
      "total": 10,
      "ok": 3,
      "installed": 0,
      "warnings": 7
    }
  }
}
